,ID,Name,Type
2060,441,Hans my Hedgehog,"A previously-childless couple (because of a hasty wish or a curse) have a son who is a hedgehog [C758.1, T554]. He becomes a swineherd in the forest, where the pigs thrive under his care. He gives directions to three (two) kings (merchant, count, king, one king three times, etc.) who have lost their way, and is promised one of their three daughters as his wife [S226]. Riding on a rooster, he goes to claim his bride three times. Two of the princesses refuse him and he scratches them, but the third agrees to marry him [B641.5]. On the wedding night (on the way to the church, after they have lived together), the animals skin is destroyed (the princess kisses the hedgehog, whips him, cuts off his head, etc.). The hedgehog is disenchanted and turns into a handsome young man [D721.3]. (The two other princesses kill themselves from jealousy and anger.) Cf. Types 425C, 433B."
2061,442,The Old Woman in the Forest (previously The Old Man in the Forest),"Robbers attack a group of travelers, and a poor servant girl survives by hiding in a tree. In the evening a dove brings her keys that unlock three trees in which she finds food, clothing, and a bed. The dove tells her to go to a little house where she will find an old woman. She should not answer any of her questions but should bring back a plain ring, leaving the shiny one there. The girl does as the dove ordered, and does not let the old woman distract her. She stops the old woman from running away with a bird cage, and finds the ring in the birds beak. While waiting for the dove, the girl puts the ring on her finger [D1076]. Immediately a tree envelops her with its branches and turns into a handsome young prince [D431.2] who explains that he had been enchanted by the witch. Other trees turn into servants and horses. The prince takes the girl to his kingdom, where they marry [L162]. Cf. Type 405."
2062,444*,Enchanted Prince Disenchanted,"(Including the previous Types 432*, 444A*, 444B*, 444D*, and 444E*.) Miscellaneous type. A prince is transformed (by a supernatural being) into an animal (monkey, fish, dragon, bird, cat, wild boar, etc.). He is disenchanted by a woman who sympathizes with him or helps him (by performing a task, obtaining a magic object, etc.)."
2063,449,Sidi Numan (previously The Tsars Dog [Sidi Numan]),"(Including the previous Type 1898*.) This tale exists chiefly in two different forms: (1) A man discovers that his wife eats corpses in the night. When he accuses her of this, she turns him into a dog. Another sorceress recognizes that the dog is really a human and returns him to his original form. With her help the husband is able to turn his wife into a mare and he beats her (to death). (2) An unfaithful wife turns her husband into a dog [D141, K1535], which herds sheep and also rescues the kings baby [D682.3]. When he returns to his wife, she turns him into a bird [D151.8]. He finds a magic wand, becomes a man again, and changes his wife and her lover into donkeys [D682.3]."
2064,400,The Man on a Quest for his Lost Wife,"(Including the previous Types 400*, 401, and 401A.) This tale exists chiefly in three different forms: (1) A man in distress (impoverished fisherman, merchant) unwittingly promises his (unborn) son to the devil [S240]. When the boy is delivered to him later, the devil cannot use him because he is protected by magic [K218.2] (cf. Type 810). Thus the boy is cast out in the sea (river, desert). He arrives in a foreign country and finds a lonely castle where he meets a bewitched princess (maiden, fairy) in the form of a serpent (deer). He rescues her by enduring three nights of torture [D758.1]. They marry [F302, L161]. When he wants to visit his parents, his wife gives him a ring to carry him home [D1470.1.15], and she forbids him to call her to come to him [C31.6] (to boast of her beauty [C31.5]). At home he is induced (by his mother) to break the taboo. His wife appears [D2074.2.3.1], takes the ring, and leaves him destitute. The man sets out in search of his wife [H1385.3]. On his way he meets three hermits (rulers of animal kingdoms, or moon, sun, and wind) whom he asks for directions [B221, H1232, H1235]. With the help of the third he arrives at the empire of his wife, or he pretends that he wants to help three giants who are fighting over magic objects (inheritance, booty). He steals the magic objects (magic sword [D1400.1.4], magic coat or hood [D1361.14], seven-league boots [D1521.1]) [D831, D832] (cf. Type 518). With their help he is able to overcome the obstacles on the way to his wife [D2121]. When he finds his wife, she is about to marry another man [N681]. He discloses his identity as her real husband. (2) Meeting the princess and disenchantment as in version (1); but the disenchantment is not complete. The princess wants to travel back to her own distant land. She asks her rescuer to wait for her at a certain time and place. She appears three times, but each time a servant (witch) has put her husband into a deep sleep from which he cannot be awakened [D1364.15, D1364.4.1, D1972]. The princess informs him (in a letter) how and where to find her ( on the glass mountain). The man sets out to find her. Continued as in version (1). (3) A youth watches a flock of birds (swans, ducks, geese, doves) land on the shore. The birds take off their feather coats and become beautiful maidens [D361.1]. While they are bathing, the youth steals the feather coat of the most beautiful girl, who cannot leave with the others and thus must marry the youth [D721.2, B652.1]. Later, because of carelessness (of the mans mother), the maiden takes back her coat [D361.1.1] and flies away (together with her children). She tells the youth her destination in the otherworld (e.g. glass mountain). The man sets out in search of his wife (as in version 1). Some variants include elements from Type 313 (Magic Flight)."
2065,401A*,The Soldiers in the Enchanted Castle,"Miscellaneous type. Twelve (seven, three) soldiers (deserters) come (often with the help of an animal or person) to a lonely castle (small house), where they receive food and lodging. A white woman (maiden who appears in a dream) asks them to stay in the castle for seven years (one year and two days) (to keep guard for three nights) and to fulfill certain conditions (not to think of a maiden, not to touch or look at the maidens who sleep in their beds, not to open a certain door). They disobey the prohibition and flee, or all (but one) leave the castle before the end of the vigil. Thus their efforts to disenchant the princesses who live in the castle are unsuccessful [D759.9]. The soldiers often return later, and the one is rewarded (often after having performed different tasks), but the others are killed. In some variants the soldiers succeed in disenchanting the princesses and each of them marries one of them (seven seven-year-old boys finally break the spell) [D759.10]."
2066,402,"The Animal Bride (previously The Mouse [Cat, Frog, etc","] as Bride). A father is not able to decide which of his (three) sons should inherit his property (kingdom) and sends them all on a quest for one year [H1210.1]. They are told to bring back a special object (yarn, linen [H1306], fine chain [H1303], ring, horse, smallest dog [H1307], money) or they must learn a profession. Whoever performs the task best will be the heir. The youngest son, often a fool, goes into a forest and becomes the servant of an animal (cat [B422], rat, frog [B493.1], mouse [B437.2]). As a payment he is given the object that his father had asked for. It proves to be the most beautiful one, and thus he should be the heir [H1242]. Because his brothers (parents) are envious, two further tasks are set, and finally the brothers are required to bring a bride (most beautiful woman [H1301.1]). The youngest returns to the animal which again promises to help. The animal is disenchanted by burning, mutilation, decapitation [D711], or by crossing a river [B313, D700], and becomes a beautiful princess with a castle. They return happily to his parents as bride and bridegroom. Sometimes they deceive the parents: The youngest son arrives dressed in rags and is ridiculed; then the bride arrives and they reveal their identities. When the son arrives in the first place dressed as a prince, a mole helps to identify him. Often the youngest son renounces his inheritance and goes with his wife back to her castle. In some variants from eastern and southeastern Europe and the Near East, the youngest son takes the animal (often a frog or toad) to his home and hides it from the family. The father assigns tasks to his daughters-in-law which the frog performs best. The last (third) task requires the brides to attend a feast, where the frog turns into the most beautiful woman. The bridegroom burns the frogs skin so that the bride cannot change back. As a consequence she leaves him, and he sets out on a quest and finally is able to retrieve her. Cf. Type 400."
2067,402*,"The Princess who Scorned an Unloved Suitor is turned into a frog (mouse, etc",")[T75.1, D661]. She is disenchanted (by another man) and her animal skin is burned in order to prevent her from changing back. Cf. Type 400."
2068,402A*,The Princess Transformed into a Toad,"A princess who has been transformed into a toad (old witch, etc.)is disenchanted by a young mans kiss (pity) and marries him. Cf. Type 440."
2069,403,The Black and the White Bride,"(Including the previous Types 403A and 403B.) A stepmother hates her stepchildren [S31]. The stepdaughter is kind to someone she meets (e.g. Christ and St. Peter) (she is sent after strawberries in winter [H1023.3], and meets dwarfs who help her). In return she is given great beauty [D1860] (the power of dropping gold or jewels from her mouth [D1454.2, D1454.1.2]). The stepmothers own daughter is unkind under these conditions and is made ugly [D1870] (made to drop toads from her mouth [M431.2]) [Q2]. The stepdaughters brother is in service at the court of a king. He takes his sisters picture with him. The king sees the girls picture, falls in love with her, and sends the brother for her [T11.2]. (The beautiful stepdaughter is seen accidentally by a king or prince, who marries her [N711, L162].) On their journey to the kings court, the stepmother or stepsister casts the true bride out of the carriage (overboard) [S432]. The king marries the ugly stepsister [K1911], and the brother is thrown into prison or a pit of snakes [Q465.1]. (The kings wife gives birth to a child. The stepmother throws her and her child into the water and substitutes her own daughter for the bride [K1911.1.2].) The true bride is transformed to a duck (goose) [D161.2], and comes to the kings court three times (to care for her child [D688]). The last night the king wakes and disenchants her by decapitation [D711] (cutting her golden belt, holding her during successive transformations [D712.4]). The brother, unharmed in the den of snakes [B848], is rescued. The true bride is married or reinstated, and the false bride and her mother are punished [Q261]. Cf. Types 450, 480, 510B, 511."
2070,403C,The Substituted Bride (previously The Witch Secretly Substitutes her own Daughter),"A witch secretly substitutes her own daughter for the bride. On the way to his home, the bridegroom discovers the substitution and throws the witchs daughter out of the carriage. The girl falls down to the earth (under a bridge), and from her navel grows a reed in which the witch recognizes her own daughter."
2071,404,The Blinded Bride,"(Previously Type 533* and part of Type 533.) A girl is blessed at birth by fairies (is kind to a snake) who cause her to produce gold (jewels, flowers) from her hands (mouth [D1454.2], footsteps [D1454.7], tears [D1454.4]). A king sees the girl and wants to marry her. Her wicked stepmother (aunt) and stepsister accompany her on the journey to the kings court. On the way, the girls stepmother feeds her with salty food. When the girl asks for water, the stepmother puts out both of her eyes [S165] or mutilates her. They take her clothes and throw her into the sea. The stepsister, posing as the bride, marries the king. A kind fisherman (poor man) finds the blinded girl, takes her home, and becomes rich from the gold from her hands. He uses the gold (jewels, flowers) to buy back the girls eyes [E781.2] (the snake commands this). The girl recovers her sight, dresses in beautiful clothes, and goes to the kings court. The king recognizes her when she washes her hands. He marries her, and the wicked women are burned. (The snake is the girls guardian angel and returns to heaven.)"
2072,405,Jorinde and Joringel,"The lovers Jorinde and Joringel accidentally go to the magic forest of a sorceress (witch). She transforms Jorinde, as she has many other girls before, into a bird [D683.2, D150] and keeps her in a cage. Joringel dreams about a magic flower, goes on a search, and finds it. He touches Jorinde and all the other birds with the flower and thus changes them back into their former shapes [D771]. Cf. Type 442."
2073,406,The Cannibal,"A couple have a child who is a cannibal [G33] who eats everyone up. A man succeeds in breaking the enchantment [D716], and the cannibal is transformed into a maiden [D11.1]. They are married [T101]. Cf. Types 307, 315A."
2074,407,The Girl as Flower,"(Including the previous Types 407A, 407B, 652A, and 702B*.) This tale exists chiefly in three different forms: (1) A girl (woman, fairy) has been transformed into a flower (twig, bush, tree, fruit) (transforms herself) [D212]. A man (her predestined lover) breaks a stalk and the flower changes back into a girl [D711.4] (he takes the girl in the form of a flower on a journey with him and transforms it afterwards). He marries her [T101] (sometimes her vegetable clothing has to be burned). Cf. Type 652. (2) After a hasty wish, a woman gives birth to a twig (bush, fruit) [T513, T555], plants it in a pot, and cares for it as for a child. A prince is irresistibly drawn to the plant and becomes love-sick [T24.1]. He obtains the plant. During the night a girl comes out of it, eats, and makes love with him. When the prince has to go to war, the girl stays in the plant. The prince attaches a bell to the plant which he will ring when he wants to call the girl. An envious woman (fiance) signals the girl to come. She appears and is killed, and her plant is destroyed. A compassionate woman resuscitates the girl [E0], and the rival is punished. (Previously Types 407A and 652A. Because of its structural similarity, also the previous Type 702B* is integrated here.) (3) A beautiful girl wants to have a lover, even if he is the devil (a dead man) [C15]. The devil comes in the form of an attractive man (with animal feet). She follows him and sees him eating corpses in a church [G20.1]. Several times she is asked whether she had seen anything. She denies this repeatedly, even when the devil kills her sister, mother, and father. At last she herself dies. Because she had made special arrangements for her funeral, the devil cannot find her. Cf. Types 363, 1476B. From her grave grows a beautiful flower (lily, rose, tulip) [E631.1] which only her predestined husband (nobleman, prince) is able to pick. Because she has to eat, at night she becomes a beautiful woman. Her husband takes her as his wife (often on the condition that he may not talk about her or present her in public, so that the devil will not be able to find her). The couple succeeds in tricking or killing the devil (the devil takes the woman to hell). (Previously Type 407B.)"
2075,408,The Three Oranges,"A prince insolently breaks an old womans jar (makes her angry in another way). She utters a curse: he is to fall in love with three oranges (lemons, other fruits, girls of magic origin) [S375]. The prince sets out on a (sometimes very long) quest during which he is given directions, advice, and help to overcome obstacles. The prince finds the fruits in a garden (castle). When he opens them, out of each comes a beautiful, often naked, young woman who asks for water (comb, mirror, towel, clothes, etc.)[D721.5]. The prince can give only the third woman what she asks for, and the other girls die (disappear, return into the fruits). The prince hides the woman on a tree besides a fountain while he goes to get clothes (carriage, company) for her. An ugly black woman (Gypsy woman, witch) comes to get water. She thinks that the reflection of the Orange Girl is her own [J1791.6.1], and breaks her water jar because she thinks she is too beautiful to carry water. The Orange Girl laughs, and the black woman discovers her. The black woman succeeds in taking the Orange Girls place (two different versions). The prince returns, and though he is astonished at the sudden change (excuses: sunburn, influences of wind and weather), he marries the false bride. (1) The black woman pushes the Orange Girl into the water [K1911.2.2], where she changes into a fish [D170] (bird [D150]). The false bride demands that it be killed, but from its remains grows a tree. She demands it be felled, but an old woman (man) takes away a splinter (log) [D610]. Out of this once again comes the Orange Girl, who secretly does the old womans housework. The old woman finds the girl and adopts her. The prince recognizes her when he hears her life history (when the girl tends one of his horses) [K1911.3]. (2) The black woman combs (louses) the Orange Girl and sticks a magic needle into her head. The girl changes into a dove [D150] and flies to the castle. The gardener (cook) hears the birds song asking about the prince and his black wife. The dove is captured and the prince is much pleased with it. He finds the magic needle and removes it, and thus the dove changes back into the Orange Girl [K1911.3]. Cf. Type 452B*. After the couples reunion, the false bride is punished (sentenced to a cruel death; she often pronounces her own judgment)."
2076,409,The Girl as Wolf,"An evil stepmother substitutes her own daughter for her married step daughter and transforms the stepdaughter into a wolf (lynx, fox) [D113.1], which hides in the forest. Every day the wolf comes, throws off her animal skin, and suckles her child (the child is brought to the forest). The childs father observes this, recognizes his beloved wife and (on the advice of a magician) burns her animal skin. Thus she is restored to human form [D721.3]. The stepmother and her daughter are executed [Q261]. Cf. Type 403."
2077,409A,The Girl as Goat,"(Including the previous Types 413A* and 413B*.) A childless woman wants a child even if it is only an animal. She bears a girl with an animal form (goat, jackdaw, pig, fish, etc.)[T554]. (An old woman finds a magic pumpkin which, at night, turns into a beautiful woman who cleans her house.) A youth (prince) observes the girl when she (while washing clothes, etc.)has removed her animal skin. He proposes to her and marries her [T111]. His mother disapproves of the marriage and torments the girl (who often plays a trick on her). Three times the girl appears at a festival in her human form, is admired, and dances. Twice she escapes and assumes her goat form. The third time the youth destroys the goat covering and disenchants the girl. Cf. Type 510A. In some variants, another young man decides to get married in the same way. But he is disappointed: his wife, a little pig, never changes into a girl."
2078,409A*,The Girl as Snake (previously Snake Princess is Disenchanted),"A snake which is pulled out of a fire turns into a woman and marries her rescuer. The husband promises never to call his wife snake. When he breaks this promise, the woman changes back into a snake and disappears (is once again delivered by her son-in-law)."
2079,409B*,The Promised Supernatural Wife (previously Child Weeping in his Mothers Womb is Promised Supernatural Wife),"An unborn boy who came into a womans womb by magic conception begins to weep [T575.1]. When someone promises him a supernatural being (fairy) as his wife, he stops crying and is willing to be born. The boy grows up very fast and sets out on a quest for the girl. With the help of supernatural beings he finds her. They marry [T111]."
2080,410,"Sleeping Beauty (Dornrschen, La bella addormentata",") (Announced by a frog [B211.7.1], B493.1) a daughter is born to a royal couple. A fairy (wise woman) who has not been invited to the celebration (baptism) utters a curse that the princess (on her 15th birthday) will die of a wound from a spindle (needle, fiber of flax) [F361.1.1, F316, G269.4, M341.2.13]. Another fairy changes the death sentence into a long (hundred-year) sleep [F316.1]. The king orders that every spindle (needle) in his empire be destroyed; but, because one of them has been overlooked, the prophecy is fulfilled [M370]: The girl meets an old woman who is spinning in a hidden chamber, pricks her finger with the spindle, and sinks, together with the whole court, into a magic sleep [D1364.17, D1960.3, F771.4.4, F771.4.7]. Around the castle grows a hedge of thorns [D1967.1] (the girl is enclosed in a tower). At the end of the appointed time, a youth (prince) breaks through the hedge [N711.2] and awakens the princess with a kiss [D735, D1978.5] (he impregnates her; she gives birth to two children, one of whom sucks the fiber out of her finger and thus disenchants her). In some variants the prince takes his wife and children to his family. During his absence the evil mother-in-law asks the cook to slaughter and roast the woman and the children. The cook disobeys, and the mother-in-law demands that the three be thrown into a tub full of poisonous toads and snakes. Unexpectedly the prince returns home, and the mother-in-law herself jumps into the tub."
2081,410*,The Petrified Kingdom,"A soldier comes to a kingdom where everything has been turned to stone. He spends three successive nights in a castle which is inhabited by evil spirits (devils), without succumbing to fear. All the kingdom revives, and the soldier marries the princess. Cf. Types 304, 307."
2082,411,The King and the Lamia,"A king sees a lovely girl who is actually a snake-woman [B29.1], falls in love, and marries her. Little by little the kings health deteriorates. A fakir tells him to feed his wife salty food and to stay up at night and watch her. The wife assumes her snake form and goes for water. An oven is heated red-hot and the snake is pushed in. A pebble is found in the ashes: Anything that it touches turns into gold [D1469.10.1]."
2083,412,The Maiden (Youth) with a Separable Soul in a Necklace,"Cf. Types 302, 403, 425. A maidens life depends upon her necklace [E711.4] which she must keep safe. She marries a prince. When a jealous girl (stepmother, stranger) steals the necklace, the bride seemingly dies and the jealous girl takes her place. The body of the seemingly dead woman is placed in a church (temple). She comes to life whenever her rival takes off the necklace. The prince finds the body of his wife and recovers the necklace (a son is born who recovers the necklace). The impostor is punished. In some variants, a prince whose soul is in a necklace [E711.4] seemingly dies when the necklace is stolen (by his stepmother). A woman marries the prince and recovers the necklace."
2084,413,The Stolen Clothing (previously Marriage by Stealing Clothing),"A youth comes upon a holy man (old woman) in the forest [N825]. He is told not to go in a certain direction, but when he does so [Z211], he sees three beautiful maidens bathing. The holy man agrees to help him, turns him into a bird, tells him to steal the clothes of one of the bathing girls [K1335], and warns him not to look back under any circumstances [C311]. The first time he does look back and is burned to a pile of ashes. The holy man restores him [E121.5], and the youth succeeds on his second attempt. Cf. Types 400, 408."
2085,300,The Dragon-Slayer,"A youth acquires (e.g. by exchange) three wonderful dogs [B421, B312.2]. He comes to a town where people are mourning and learns that once a year a (seven-headed) dragon [B11.2.3.1] demands a virgin as a sacrifice [B11.10, S262]. In the current year, the kings daughter has been chosen to be sacrificed, and the king offers her as a prize to her rescuer [T68.1]. The youth goes to the appointed place. While waiting to fight with the dragon, he falls into a magic sleep [D1975], during which the princess twists a ring (ribbons) into his hair; only one of her falling tears can awaken him [D1978.2]. Together with his dogs, the youth overcomes the dragon [B11.11, B524.1.1, R111.1.3]. He strikes off the dragons heads and cuts out the tongues (keeps the teeth) [H105.1]. The youth promises the princess to come back in one year (three years) and goes off. An impostor (e.g. the coachman) takes the dragons heads, forces the princess to name him as her rescuer [K1933], and claims her as his reward [K1932]. The princess asks her father to delay the wedding. Just as the princess is about to marry the impostor, the dragon-slayer returns. He sends his dogs to get some food from the kings table and is summoned to the wedding party [H151.2]. There the dragon-slayer proves he was the rescuer by showing the dragons tongues (teeth) [H83, H105.1]. The impostor is condemned to death, and the dragon-slayer marries the princess. Cf. Types 301, 303, 314, 315, 502, 530, 554."
